username,tweet,waktu,likes,retweets,replies,tweet_link
City Guide 911 FM,"City Guide 911 FM City Guide 911 FM @cityguide911fm · ""Peningkatan alih fungsi lahan juga meningkatkan  pencemaran air  sungai dan mempengaruhi tingginya sedimen,"" kata Runi dalam Idjen Talk. cityguide911fm.com cityguide911fm.com Jumlah Penduduk Naik Ancam Ekosistem Sungai Malang Jumlah Penduduk Naik Ancam Ekosistem Sungai Malang Idjen Talk edisi 29 Agustus 2024, ""Sungai Malang Tercemar, Sudah Waktunya Ada Aksi Nyata"" CITY GUIDE FM, IDJEN TALK - Tantangan kemajuan sektor perekonomian di Kota Malang tampaknya belum diiringi... Idjen Talk edisi 29 Agustus 2024, ""Sungai Malang Tercemar, Sudah Waktunya Ada Aksi Nyata"" CITY GUIDE FM, IDJEN TALK - Tantangan kemajuan sektor perekonomian di Kota Malang tampaknya belum diiringi... 1 1 1 370 370 370",29-08-2024 14:04,0,0,0,https://x.com/cityguide911fm/status/1829052446666363318
Harian Metro,Harian Metro Harian Metro @hmetromy · #KualaLumpur  Mesyuarat Majlis  Air  Negara hari ini bersetuju terhadap keperluan menubuhkan satu jawatankuasa kerja bagi meneliti ancaman  pencemaran air  di Malaysia dengan membabitkan semua pemegang taruh untuk memastikan masalah itu dapat ditangani segera. hmetro.com.my hmetro.com.my Jawatankuasa kerja akan ditubuh untuk teliti ancaman pencemaran air - PM | Harian Metro Jawatankuasa kerja akan ditubuh untuk teliti ancaman pencemaran air - PM | Harian Metro Kuala Lumpur: Mesyuarat Majlis Air Negara hari ini bersetuju terhadap keperluan menubuhkan satu jawatankuasa kerja bagi meneliti ancaman pencemaran air di Malaysia dengan membabitkan semua pemegang... Kuala Lumpur: Mesyuarat Majlis Air Negara hari ini bersetuju terhadap keperluan menubuhkan satu jawatankuasa kerja bagi meneliti ancaman pencemaran air di Malaysia dengan membabitkan semua pemegang... 1.4K 1.4K 1.4K,13-09-2024 22:31,0,0,0,https://x.com/hmetromy/status/1834615802341032133
UMNO Online,UMNO Online UMNO Online @umnoonline · Pencemaran Air  Tidak Berkesudahan… Pindaan Tambah Baik Akta Amat Bertepatan umno-online.my umno-online.my Pencemaran Air Tidak Berkesudahan… Pindaan Tambah Baik Akta Amat Bertepatan Pencemaran Air Tidak Berkesudahan… Pindaan Tambah Baik Akta Amat Bertepatan 1 1 1 2 2 2 230 230 230,12-12-2024 15:35,0,0,0,https://x.com/umnoonline/status/1867126153494086080
nat,"nat nat @nanatashaaaaa · tolong investigate yang buat  pencemaran . penat penat hafal karangan  pencemaran  udara  air  darat, sesedap orang tu je buat daily life terumbang ambing. penat woi balik kerja terus tadah  air Air Selangor Air Selangor @air_selangor · Sehingga jam 9:00 malam, Loji Rawatan Air (LRA) SSP1, SSP2 dan SSP3 sudah mula beroperasi.

Air Selangor sedang berusaha sedaya upaya untuk meminimumkan impak kepada para pengguna. Bantuan alternatif melalui lori-lori tangki air telah digerakkan ke kawasan-kawasan yang terjejas, Show more 2 2 2 588 588 588",23-07-2024 22:08,0,0,0,https://x.com/nanatashaaaaa/status/1815765934419935674
PAS Selangor,"PAS Selangor PAS Selangor @PASelangor · PENCEMARAN AIR  SUNGAI KUANG

Selangor masih tidak selesai dengan isu  pencemaran  kilang. Isu yang acap kali disuarakan rakyat dan dibangkitkan oleh wakil rakyat. 

Baca lanjut di : https:// nZYmYzMweE/?mibextid=qi2Omg … 90 90 90",05-08-2024 14:45,0,0,0,https://x.com/PASelangor/status/1820365518987248107
Astro AWANI,"Astro AWANI Astro AWANI @501Awani · Pencemaran air  bawah tanah dan tanah  mencapai tahap kritikal, menimbulkan kebimbangan sama ada isu ini dapat ditangani tepat pada masanya. #AWANInews #AWANI745 astroawani.com astroawani.com Pembinaan semula Gaza mungkin ambil masa 80 tahun - PBB Pembinaan semula Gaza mungkin ambil masa 80 tahun - PBB Pencemaran air bawah tanah dan tanah mencapai tahap kritikal, menimbulkan kebimbangan sama ada isu ini dapat ditangani tepat pada masanya. Pencemaran air bawah tanah dan tanah mencapai tahap kritikal, menimbulkan kebimbangan sama ada isu ini dapat ditangani tepat pada masanya. 2 2 2 7 7 7 4.6K 4.6K 4.6K",19-10-2024 23:09,0,0,0,https://x.com/501Awani/status/1847671345821470764
SinarHarian,"SinarHarian SinarHarian @SinarOnline · Jawatankuasa kerja ditubuh teliti ancaman  pencemaran air  - PM

Kerajaan juga akan terus beri fokus bagi mengurangkan bekalan  air  tidak berhasil yang masih berada pada tahap yang kurang memuaskan. -  @anwaribrahim #SinarHarian #ancaman #pencemaranair https:// 3 3 3 936 936 936",13-09-2024 23:21,0,0,0,https://x.com/SinarOnline/status/1834628495458340877
Solok Selatan INFO,"Solok Selatan INFO Solok Selatan INFO @InfoSOLSEL · Kapolres Solsel Serius Tangani Ilegal Mining, Amankan 38 Tersangka Kurun waktu 2022-2024

Serius. Terkait aktifitas Penambangan emas ilegal yang sering kali mengakibatkan kerusakan lingkungan yang parah, erosi tanah,  pencemaran air , dan lain lain,... fokussumatera.com fokussumatera.com Kapolres Solsel Serius Tangani Ilegal Mining, Amankan 38 Tersangka Kurun waktu 2022-2024 Kapolres Solsel Serius Tangani Ilegal Mining, Amankan 38 Tersangka Kurun waktu 2022-2024 Kapolres Solok Selatan AKBP Arief Mukti S.A.S S.H., S.I.K., M.Si, saat penangkapan alat berat tambang ilegas dan himbauan larangan aktifitas... Kapolres Solok Selatan AKBP Arief Mukti S.A.S S.H., S.I.K., M.Si, saat penangkapan alat berat tambang ilegas dan himbauan larangan aktifitas... 11 11 11",13-09-2024 19:21,0,0,0,https://x.com/InfoSOLSEL/status/1834567988860666256
SinarHarian,"SinarHarian SinarHarian @SinarOnline · Pindaan Akta Industri Perkhidmatan  Air  dibentang di Dewan Rakyat

Rang undang-undang itu antara lain bagi membolehkan mahkamah memerintahkan pihak yang melakukan  pencemaran  membayar kos bagi memulihkan sistem bekalan  air . #SinarHarian #DewanRakyat #AktaIndustriPerkhidmatanAir Show more 569 569 569",14-10-2024 14:42,0,0,0,https://x.com/SinarOnline/status/1845731816969568569
hi,"hi hi @Icahairunisa · Manusia tambah banyak, kebutuhan  air  berbanding lurus dg jumlah populasi manusia. Manusia nambah, pun  pencemaran air  bersih juga.
Kita sering menduga-duga es batu pedagang  air  tebu pinggir jalan banyak bakterinya. Ternyata es batu produksi pabrikan juga tak kalah banyak  Ivan S Jayawan, PhD Ivan S Jayawan, PhD @ivanjayawan · Pas bgt lg ngomongin E.coli, ada temen org lab yg lg uji kualitas air yg dipakai u/ es batu salah satu kopi yg terkenal, beliau kaget ngeliat total coliform nya kayak gini  Sooooo, please beware on what goes into your stomach please!! 42 42 42",06-11-2024 12:09,0,0,0,https://x.com/Icahairunisa/status/1854028323615395982
aragiru.kt,"aragiru.kt aragiru.kt @aragiru_ · List kekurengan masyarakat indon yang baru disadari skrg2:
- Kelistrikan rumah gak pake proper grounding
- Pengolahan sampah gak proper
- Saluran sanitasi rumah ternyata gak proper juga penyebab  pencemaran air 1 1 1 3 3 3 72 72 72",23-11-2024 11:23,0,0,0,https://x.com/aragiru_/status/1860177383808204805
KabarSelebes.co.id,KabarSelebes.co.id KabarSelebes.co.id @kabarselebes · PT ABM Dorong Inisiatif Hijau di Tengah Tuduhan  Pencemaran  Mata  Air http:// 6 6 6,01-09-2024 22:10,0,0,0,https://x.com/kabarselebes/status/1830261978688106823
Lu ·ᴗ·,"Lu ·ᴗ· Lu ·ᴗ· @_nichtglauben · pencemaran  NaOH yang kita semua lihat~ let's see ke depannya seperti apa. siap-siap aja sih  pencemaran air , udara, tanah. belom lagi pengeroposan struktur yuhu seru sekali! bayangin zatnya menyerap ke dalam tanah aja dulu, diserap tanaman, trus dimakan binatang, kita makan. Radio PRFM Radio PRFM @PRFMnews · 10.45 RT  @usabperning_ @usabperning_ Untuk kendaraan yg menuju jalur Padalarang-cikalong atau sebaliknya   

Silahkan cari alternatif  

Ada truk muatan bahan kimia jenis remover jebol di area sepanjang cikamuning-warungdomba  

Korban kendaraan sudah banyak  Harap hati² 1 1 1 97 97 97",26-12-2024 01:00,0,0,0,https://x.com/_nichtglauben/status/1871979458024067401
Dlhpromal,"Dlhpromal Dlhpromal @dlhpromal · Sosialisasi Pengendalian  Pencemaran Air  Dengan Konsep Infrastruktur Hijau.

Kegiatan ini bertujuan untuk meningkatkan kapasitas pemerintah daerah dalam pelaksanaan pengendalian  pencemaran air .  @p3e_suma #salamlestari #dlhpromal Dlh Prov Maluku (@dlhpromal) • Instagram reel 5 5 5",21-06-2024 06:40,0,0,0,https://x.com/dlhpromal/status/1803936090350608828
IMITS PAKA,"IMITS PAKA IMITS PAKA @DunPaka · Peruntukan Segera RM100,000 Atasi  Pencemaran Air  Takungan Pulau Redang trdi.my trdi.my Peruntukan Segera RM100,000 Atasi Pencemaran Air Takungan Pulau Redang Peruntukan Segera RM100,000 Atasi Pencemaran Air Takungan Pulau Redang SETIU, 25 September - Kerajaan negeri bersetuju melu... SETIU, 25 September - Kerajaan negeri bersetuju melu... 32 32 32",26-09-2024 08:21,0,0,0,https://x.com/DunPaka/status/1839112962654744675
Le charle,"Le charle Le charle @charlessiahaan · Samsun Ingatkan  Pencemaran Air  Sungai Akibat Eksploitasi Batu Bara Semakin Parah 1bangsa.id 1bangsa.id Samsun Ingatkan Pencemaran Air Sungai Akibat Eksploitasi Batu Bara Semakin Parah Samsun Ingatkan Pencemaran Air Sungai Akibat Eksploitasi Batu Bara Semakin Parah SAMARINDA - Anggota DPRD Kaltim dari Fraksi PDI Perjuangan, Muhammad Samsun, mengingatkan masalah pencemaran air sungai yang menurutnya sudah kian parah di wilayah Benua Etam.Salah satu penyebab... SAMARINDA - Anggota DPRD Kaltim dari Fraksi PDI Perjuangan, Muhammad Samsun, mengingatkan masalah pencemaran air sungai yang menurutnya sudah kian parah di wilayah Benua Etam.Salah satu penyebab... 19 19 19",04-12-2024 12:00,0,0,0,https://x.com/charlessiahaan/status/1864172894571646985
𝑫𝒆𝒔𝒕𝒚𝒂𝒏𝒂,"𝑫𝒆𝒔𝒕𝒚𝒂𝒏𝒂 𝑫𝒆𝒔𝒕𝒚𝒂𝒏𝒂 @syadestyana · @syadestyana Kita kembali lagi ke tugas utama awak kabin atau pramugari, yaitu memastikan keselamatan penumpang dalam keadaan darurat.

Pada saat keadaan darurat dan membutuhkan proses evakuasi, pramugari harus mengevakuasi atau mengeluarkan semua penumpang dari pesawat dlm waktu tidak lebih Show more 1 1 1 12 12 12 520 520 520 125K 125K 125K",18-09-2023 12:56,0,0,0,https://x.com/syadestyana/status/1703649264839406068
Chatnews ID,Chatnews ID Chatnews ID @chatnews_id · Kerusakan Lingkungan hingga  Pencemaran Air  Jadi Musuh Utama di Bandung  https:// -lingkungan-hingga-pencemaran-air-jadi-musuh-utama-di-bandung … 12 12 12,07-09-2024 15:03,0,0,0,https://x.com/chatnews_id/status/1832328908320243889
Ginaaa,"Ginaaa Ginaaa @Matilda25__ · @tanyarlfes Yang kuning itu bangunan, papan, atau apalah itu , kuning bawahnya (yang diinjek burungnya) itu bayangannya. Airnya ngelilingi si bidang kuning itu. Anglenya pas banget. 1 1 1 2 2 2 424 424 424 10K 10K 10K",02-03-2024 10:02,0,0,0,https://x.com/Matilda25__/status/1763761820433846274
Fuza Firdaus Zhan,"Fuza Firdaus Zhan Fuza Firdaus Zhan @FuzaFirdaus · Nyalahin Supadio cuma melayani penerbangan ke Malaysia, padahal ya karena runwaynya belum memadai koplak.

Coba pusat itu cepat kerjakan perpanjangan runway PNK jadi 3.000 meter plus taxiway, yakin besoknya China Airlines, EVA  Air , &  Air  China auto masuk sini. 20 20 20 52 52 52 232 232 232 15K 15K 15K",27-04-2024 11:29,0,0,0,https://x.com/FuzaFirdaus/status/1784077352592351361
Irfan_newboys,"Irfan_newboys Irfan_newboys @Marchfoward · TERKINI 

Seorang terbunuh dan ada yang Cedera dalam penerbangan Singapore Airlines SQ321 dari Heathrow London ke Singapura kerana Gelora Udara(Turbulence) 

Pesawat itu ditukar arah ke Bangkok, Thailand susulan kejadian itu dan mendarat Jam 3.45 Petang 21 Mei 2024 131 131 131 233 233 233 42K 42K 42K",21-05-2024 18:18,0,0,0,https://x.com/Marchfoward/status/1792877537174933889
TNI Angkatan Udara,TNI Angkatan Udara TNI Angkatan Udara @_TNIAU · Perbandingan yg beredar di media sosial tanpa memahami latar belakang teknis dapat menimbulkan kesalahpahaman. TNI AU menegaskan bhw metode pencucian yg diterapkan merupakan bagian dari prosedur perawatan yg telah teruji & dilakukan secara profesional oleh teknisi berpengalaman. 0:26 0:26 76 76 76 137 137 137 433 433 433 102K 102K 102K,20-02-2025 07:41,0,0,0,https://x.com/_TNIAU/status/1892373917412597808
,@callendulee · @callendulee 6. Drainase jaring di Australia mencegah  pencemaran  badan  air . Harus menjadi standar di seluruh dunia. 4 4 4 125 125 125 2.1K 2.1K 2.1K 122K 122K 122K,26-03-2025 01:20,0,0,0,https://x.com/callendulee/status/1904599338762088556
Semesta Sains,"Semesta Sains Semesta Sains @semestasains · Video mengagumkan ketika kamera balon cuaca menangkap pesawat terbang yang melintas dibawahnya, lengkap dengan jejak Contrailnya. 11 11 11 177 177 177 656 656 656 39K 39K 39K",17-01-2025 18:39,0,0,0,https://x.com/semestasains/status/1880218430835683640
Merapi Uncover,"Merapi Uncover Merapi Uncover @merapi_uncover · [Breaking News] 2 Titik pusaran angin terpantau dari Pantai Gesing, Girikarto Panggang, Gunungkidul, siang ini. Video warga yang direkam dari atas tebing tersebut memperlihatkan pusaran angin dari atas membumbung ke atas awan.

Menurut informasi, angin terbentuk tepatnya di Show more 78 78 78 407 407 407 1.7K 1.7K 1.7K 151K 151K 151K",19-05-2025 13:22,0,0,0,https://x.com/merapi_uncover/status/1924349827498037382
Angin,"Angin Angin @JancukSaciladh · @tanyakanrl Maaf kamera kurang bagus (hp low end) juga masih ada pantulan kaca jendela, tapi lumayan utk berbagi pemandangan saat jalan udara terasa ramai.
Ada petir dan awan, ada juga papasan dg pesawat lain. 5 5 5 13 13 13 263 263 263 14K 14K 14K",29-04-2025 01:38,0,0,0,https://x.com/JancukSaciladh/status/1916925038651183487
Dandhy Laksono,"Dandhy Laksono Dandhy Laksono @Dandhy_Laksono · @Dandhy_Laksono Untuk memperluas bandara IWIP seluas 725.000 m2, dilakukan reklamasi yang bahan urukannya dari limbah slag peleburan nikel, abu batubara, dan limbah berbahaya lainnya.

Ini berkontribusi pada  pencemaran  perairan di sekitarnya. 5 5 5 84 84 84 236 236 236 40K 40K 40K",28-05-2025 18:12,0,0,0,https://x.com/Dandhy_Laksono/status/1927684326944043239
𝒅𝒆 𝑷𝒂𝒊𝒎𝒊𝒏,"𝒅𝒆 𝑷𝒂𝒊𝒎𝒊𝒏 𝒅𝒆 𝑷𝒂𝒊𝒎𝒊𝒏 @celoteh_paimin · Nak,
Sederhana itu tak rumit, bisa dijalani dalam kondisi yang terkadang sulit. 

Sederhana itu juga lebih mudah, biayannyapun jauh lebih murah. 

Meski sederhana bisa membawa bahagia, kecuali kau ingin riuh tepuk tangan, dianggap hebat meski menjalaninya sekarat.  #CelahAwan 1 1 1 93 93 93 422 422 422 19K 19K 19K",20-01-2025 13:38,0,0,0,https://x.com/celoteh_paimin/status/1881229857797128507
CHERSAN SRISATJANG,"CHERSAN SRISATJANG CHERSAN SRISATJANG @RonallChersan · เพิ่งเห็นว่ามีเคสนี้ Sky Angor Airlines ของกัมพูชา ไฟล์ทสุวรรณภูมิ-พนมเปญ ขณะกำลังจะบินขึ้น ลูกเรือตีกัน (ไม่ชัวร์ว่านักบินหรือพนง.ต้อนรับฯ) 

สุดท้ายต้องกลับไปเกต เปลี่ยนลูกเรือใหม่ ดีเลย์ไป 6ชม.  สายการบินออกหนังสือ ย้ำได้เปิดสอบสวน เพื่อป้องกันไม่ให้เกิดเหตุอีกในอนาคต 0:20 0:20 3 3 3 1.7K 1.7K 1.7K 445 445 445 103K 103K 103K",03-02-2025 16:01,0,0,0,https://x.com/RonallChersan/status/1886339298955502026
Shine,"Shine Shine @bedazzlingyou · sbg org yg punya alergi bejibun + punya masalah pernapasan mau bilang 

MAKASIH BGT SAMA YG CIPTAIN  AIR  PURIFIER  udara, debu, virus, punya anabul, dan keadaan sekarang tuh emang better punya  air  purifier LIFE SAVER BGT  Vivian Vivian @suchnerve · lazy people should be made aware of the fact that air purifiers, in addition to removing virus-containing respiratory droplets and aerosols from the air, ALSO remove dust and thereby dramatically reduce how often you have to clean 34 34 34 254 254 254 348 348 348 19K 19K 19K",05-05-2025 08:41,0,0,0,https://x.com/bedazzlingyou/status/1919205711911010485
Miss Tweet |,"Miss Tweet | Miss Tweet | @Heraloebss · Aksi Heroik Pemancing Selamatkan Wisatawan Terseret Ombak Pantai Selatan dengan ""Drone"" dàn Joran  (10/5/2025) Pantai Ketawang Purworejo

KRONOLOGI

Kejadian tersebut bermula ketika rombongan keluarga dari Dusun Ngadireso, Desa Ngadi Kusuman, Kecamatan Kretek, Kabupaten Show more 169 169 169 859 859 859 4.7K 4.7K 4.7K 936K 936K 936K",11-04-2025 09:48,0,0,0,https://x.com/Heraloebss/status/1910525407407071511
MENTAL RECEH,MENTAL RECEH MENTAL RECEH @MENTALRECEH · Rangkaian kec*lakaan pesawat mengerikan terekam kamera  (Jangan dibuka Jika Anda takut terbang) 10 10 10 107 107 107 1.6K 1.6K 1.6K 831K 831K 831K,03-03-2025 20:30,0,0,0,https://x.com/MENTALRECEH/status/1896553817086611722
Gerry Soejatman,"Gerry Soejatman Gerry Soejatman @GerryS · Pesawat  Air  Busan terbakar di Busan Gimhae Airport (PUS).

Menurut info, api mulai dari bagian ekor pesawat.
170 penumpang plus seluruh crew berhasil evakuasi menggunakan emergency slides.

Pesawat tadinya hendak berangkat ke ong Kong. Kejadian sekitar 1030 local time malam ini. Show more 19 19 19 161 161 161 551 551 551 42K 42K 42K",28-01-2025 21:34,0,0,0,https://x.com/GerryS/status/1884248574374126025
P,"P P @PikamonID · Pernah baca salah satu quotes yang jadi reminder aku juga, “kupu-kupu berhenti terbang saat hujan, karena itu akan merusak sayapnya”.
Jadi gapapa untuk berhenti sejenak saat badai datang, nanti kamu akan terbang lagi setelah badainya reda. And when it does, you keep going.- 223 223 223 18 18 18 279 279 279 3.4K 3.4K 3.4K",30-01-2025 07:32,0,0,0,https://x.com/PikamonID/status/1884761546796290062
Arif,"Arif Arif @arifmuharram · Produk Pertamina kemasukan  air  ga cuma di bengsin pada umumnya, tapi pernah di avtur tahun 2010. Cathay Pacific CX780 SUB-HKG, 2 engines shut down during final approach. Nyaris jadi bencana besar di Hong Kong. https:// cific_Flight_780 … Pertamina Patra Niaga Jawa Bagian Tengah Pertamina Patra Niaga Jawa Bagian Tengah @PertaminaRJBT · @bakri_guru @bakri_guru Halo, Sobat. Mohon maaf atas ketidaknyamanan yang dialami. Perlu kami konfirmasi bahwa konsumen pemilik Honda HRV tersebut mengisi BBM di SPBU Pucang Sawit dan telah mendapat ganti rugi dari SPBU terkait. (1/4) 74 74 74 2.2K 2.2K 2.2K 7.2K 7.2K 7.2K 464K 464K 464K",10-03-2025 21:24,0,0,0,https://x.com/arifmuharram/status/1899104146365804778
vnomenon,"vnomenon vnomenon @vnomenon · กรมฝนหลวงฯ บินเจาะชั้นบรรยากาศลดฝุ่นPM 2.5 ได้ผลถึง 50%

กีบก็ด่าต่อไปสิ ด่าไป 2 2 2 146 146 146 359 359 359 15K 15K 15K",09-01-2025 12:16,0,0,0,https://x.com/vnomenon/status/1877222956293623852
Susi Pudjiastuti,"Susi Pudjiastuti Susi Pudjiastuti @susipudjiastuti · Bandara yg tidak memiliki penerbangan lebih banyak lagi, frekwensi penerbangan & jumlah pesawat terbang komersil s juga turun tapi private jet tambah banyak. yang tidak turun & bahkan naik ribuan persen adalah biaya2 service di penerbangan dari landing fee, navigasi, ground Show more VivaCoid VivaCoid @VIVAcoid · Empat Bandara yang Nganggur di Indonesia: Sebuah Ironi Pembangunan Infrastruktur

  https://wisata.viva.co.id/berita/15620-empat-bandara-yang-nganggur-di-indonesia-sebuah-ironi-pembangunan-infrastruktur… https:// mpat-bandara-yang-nganggur-di-indonesia-sebuah-ironi-pembangunan-infrastruktur … 177 177 177 859 859 859 2.9K 2.9K 2.9K 131K 131K 131K",06-02-2025 18:10,0,0,0,https://x.com/susipudjiastuti/status/1887458730893320258
𝒅𝒆 𝑷𝒂𝒊𝒎𝒊𝒏,"𝒅𝒆 𝑷𝒂𝒊𝒎𝒊𝒏 𝒅𝒆 𝑷𝒂𝒊𝒎𝒊𝒏 @celoteh_paimin · Nak,
Tak semua rencana dan pekerjaan dapat berjalan sesuai ekespektasi, sedetail apapun kita berupaya merencanakan dan mempersiapkan diri. 

Tetapi, satu hal yang harus kamu pegang, jangan menyerah, mundur lalu pulang, hanya karena rintangan yang menghadang.  #CelahAwan 6 6 6 85 85 85 407 407 407 14K 14K 14K",24-01-2025 16:47,0,0,0,https://x.com/celoteh_paimin/status/1882726940777582670
Kementerian Peralihan Tenaga dan Transformasi Air,"Kementerian Peralihan Tenaga dan Transformasi Air Kementerian Peralihan Tenaga dan Transformasi Air @PETRAMalaysia · Projek Loji Rawatan Kumbahan Serantau dan Rangkaian Paip Pembentungan di Papan, Daerah Kinta, Perak (PAKEJ 1)

Inisiatif ini bukan sahaja membekalan  air  bersih secara berterusan, malah mengurangkan  pencemaran  sungai.  #PETRA #EkonomiMADANI #MalaysiaMADANI #MADANIBekerja 2 2 2 121 121 121",09-02-2025 07:00,0,0,0,https://x.com/PETRAMalaysia/status/1888377273025527980
Fraksi Partai Demokrat DPR-RI,"Fraksi Partai Demokrat DPR-RI Fraksi Partai Demokrat DPR-RI @FPD_DPR · KABAR TERKINI
19 FEBRUARI 2025

KOMISI XII DPR RI

MULYADI: PERLUASAN TAMBANG BISA PICU  PENCEMARAN , PENGELOLAAN  AIR  ASAM HARUS DIPASTIKAN

MULYADI 
ANGGOTA KOMISI XII DPR RI FRAKSI PARTAI DEMOKRAT  @DPR_RI @PDemokrat https:// 55 55 55",19-02-2025 22:25,0,0,0,https://x.com/FPD_DPR/status/1892234073902313573
Yuki (ゆうき),"Yuki (ゆうき) Yuki (ゆうき) @daddyyuki · Kok bisa  pencemaran  diseluruh Jepang bahkan mata  air  di gunung² Berarti PFAS/PFOS di semprotkan dari udara.... pakai Pesawat  jawabannya Chemtrail.... nyambung khan? https:// us/1895270493772722605?t=bJIQgja7GcTM-L0UAB6MqQ&s=09 … Yuki (ゆうき) Yuki (ゆうき) @daddyyuki · Jepang darurat PFAS PFAS (PFOS) adalah zat kimia beracun tinggi yg tidak akan bisa terurai alam di temukan dalam jumlah tinggi di air tanah seluruh Jepang. tidak hanya air PDAM tapi air tanah dan air mineral pun tercemar. 
KaburDuluDariJepang 12 12 12 22 22 22 608 608 608",28-02-2025 11:30,0,0,0,https://x.com/daddyyuki/status/1895330615614214352
EvolusiBina,EvolusiBina EvolusiBina @evolusibina · #Selangor  Projek Skim Jaminan  Air  Mentah (SJAM) mampu memberi penyelesaian sehingga 99 peratus kepada masalah  pencemaran air  atau musim kemarau di Selangor. Projek Skim Jaminan Air Mentah (SJAM) mampu memberi penyelesaian sehingga 99 peratus kepada masalah... 40 40 40,13-05-2025 21:11,0,0,0,https://x.com/evolusibina/status/1922293558746206434
TV Tempo,"TV Tempo TV Tempo @TVTempoChannel · Info Tempo - Industri nikel tak hanya membawa sisi positif berupa pendapatan negara, melainkan juga malapetaka  pencemaran air .  Tempo pernah mencatat  pencemaran air  di Maluku Utara akibat tambang nikel. Setidaknya dari 6 sungai yang dilakukan pengujian laboratorium. 1 1 1 1 1 1 71 71 71",12-05-2025 16:53,0,0,0,https://x.com/TVTempoChannel/status/1921866224352243974
Rachmady Azis,"Rachmady Azis Rachmady Azis @RachmadyAzis · Jumat (21/2/25), Rachmady Luhkan Makassar, BRPBAP3 maros, penyerahan sampel  air  ke Lab Uji terkait kematian massal ikan di Klp Nila Tello. Hasil : amoniak tinggi. Asumsi terjadi  pencemaran air . @BRPBAP3_Maros @pusluh_bppsdm #GiatLuhkanSatminkalMaros #luhlapor @Luhkan_Makassar 9 9 9 150 150 150",24-02-2025 07:40,0,0,0,https://x.com/RachmadyAzis/status/1893823368765288454
BP2 PROV JATENG,BP2 PROV JATENG BP2 PROV JATENG @Bp2ProvJtg · Salah satu parameter pengujian  air  yang ada di Balai Pengujian dan Peralatan yaitu pengujian BOD(Biologi Oxygen Demand) adl pengukuran jumlah oksigen dalam  air Uji BOD merupakan salah satu cara menilai kualitas  air  dari beban  pencemaran  akibat  air  buangan penduduk atau industri. 1 1 1 45 45 45,28-04-2025 17:59,0,0,0,https://x.com/Bp2ProvJtg/status/1916809450092183794
bes |,"bes | bes | @kafir_introver · @kafir_introver ketika the pessimist actually won, akan ada masanya dimana ekspor sawit & tambang turun drastis, berbarengan dengan kekeringan karena gelombang panas dipicu hutan papua dibabat, bikin gagal panen massal juga karena  pencemaran air  dan tanah, seraya mayoritas populasi udah tua. 1 1 1 27 27 27 155 155 155 17K 17K 17K",13-01-2025 03:07,0,0,0,https://x.com/kafir_introver/status/1878534203224039493
Hj. Nevi Zuairina,"Hj. Nevi Zuairina Hj. Nevi Zuairina @NZuairina · Jika kita tidak segera berubah, bencana hidrometeorologi,  pencemaran air  dan udara, serta krisis pangan akibat degradasi lingkungan akan semakin sering terjadi. Ini bukan retorika, ini peringatan. Mari kita selamatkan bumi kita. Negara Darurat Sampah, Nevi Zuairina Sampaikan Saatnya Tindakan Nyata Selamatkan Lingkungan - Hj.... 24 24 24",23-05-2025 09:59,0,0,0,https://x.com/NZuairina/status/1925748310851059936
.nan,".nan .nan @nadeuxx · Tolong cek PDAM Tirta Patriot bekasi pliss, curiga ada korupsi jg ituu. Masa kita udah bayar, kualitas  air  jelek bgt. Dibilang ada  pencemaran  lah, apalah.. Suss bgt pdam bekasi ini. Tanyarlfes Tanyarlfes @tanyarlfes · Automated  scroll dikit ada korupsi 2 2 2 5 5 5 15 15 15 622 622 622",11-03-2025 21:40,0,0,0,https://x.com/nadeuxx/status/1899470403342589968
Pemprov DKI Jakarta,"Pemprov DKI Jakarta Pemprov DKI Jakarta @DKIJakarta · Warga Jakarta, sudah tahu belum?  Air  limbah di Jakarta harus dikelola sesuai dengan Perda No. 10 tahun 2024 dengan alasan supaya bisa meningkatkan kesehatan masyarakat hingga agar mengendalikan  pencemaran  sumber daya  air  dan tanah. 3 3 3 2 2 2 5 5 5 1.1K 1.1K 1.1K",10-02-2025 19:21,0,0,0,https://x.com/DKIJakarta/status/1888926284207861873
