username,tweet,waktu,likes,retweets,replies,tweet_link
ElangJava,"ElangJava ElangJava @QaulanSyaqiila · Innalillahi..
Angin Puting Beliung sore hari ini di Pantai Kenjeran, Surabaya.. (17/Feb/2021) 12 12 12 70 70 70 218 218 218",17-02-2021 16:22,0,0,0,https://x.com/QaulanSyaqiila/status/1361969368322744324
Air Selangor,Air Selangor Air Selangor @air_selangor · Air  Selangor ingin memaklumkan henti tugas Loji Rawatan  Air  Sungai Semenyih (LRA Sg. Semenyih) berikutan  pencemaran  bau diesel yang telah dikesan di Sungai Semenyih.  #AirSelangor #HentiTugas #1216SgSemenyih 111 111 111 904 904 904 295 295 295,16-12-2021 10:31,0,0,0,https://x.com/air_selangor/status/1471322146349613059
Kementerian Alam Sekitar dan Air,"Kementerian Alam Sekitar dan Air Kementerian Alam Sekitar dan Air @KASA_MALAYSIA · Tahukah anda pelepasan sisa makanan, minyak dan gris dari premis-premis makanan ke longkang adalah antara punca-punca  pencemaran  sungai.

Rujuk garis panduan ini untuk maklumat lanjut berkenaan pemasangan perangkap minyak di premis makanan:  https:// PDF/Pekeliling%20JKT/2018/Garis_Panduan_Pemasangan_Perangkap_Minyak_di_Premis_Makanan_di_Kawasan_Pihak_PBT_KPKT.pdf … 2 2 2 50 50 50 59 59 59",11-09-2021 10:36,0,0,0,https://x.com/KASA_MALAYSIA/status/1436534135711944706
TNI Angkatan Udara,"TNI Angkatan Udara TNI Angkatan Udara @_TNIAU · Pantauan udara pesawat CN-295 A-2904 pilot Kpt Pnb Gilang Prananjaya, di lokasi diduga jatuhnya Sriwijaya SJ-182, tampak tumpahan minyak yang kemungkinan berasal dari SJ-182 di  perairan Kepulauan Seribu, Minggu (10/1/2021).  #tniau #jauhdilangitdekatdihati 36 36 36 584 584 584 2.3K 2.3K 2.3K",10-01-2021 13:00,0,0,0,https://x.com/_TNIAU/status/1348147584884379652
glennmars,"glennmars glennmars @glennmars · Aturan Terbaru PPKM, Naik Pesawat Wajib Tes PCR, Tak Lagi Bisa Pakai Antigen (walau sudah vaksin penuh ya gaes...) Aturan Terbaru PPKM, Naik Pesawat Wajib Tes PCR, Tak Lagi Bisa Pakai Antigen 573 573 573 2.4K 2.4K 2.4K 2.9K 2.9K 2.9K",19-10-2021 15:09,0,0,0,https://x.com/glennmars/status/1450373569951584256
KemenLH_BPLH,"KemenLH_BPLH KemenLH_BPLH @KLH_BPLH · [PENGENDALIAN  PENCEMARAN AIR  DI DAS CILIWUNG]⁣⁣⁣
⁣⁣⁣
Dalam rangka koordinasi dan pemberdayaan dalam pengendalian  pencemaran air , khususnya Daerah Aliran Sungai Ciliwung, Direktorat Jenderal PPKL menyelenggarakan kegiatan Bimtek.

@KementerianLHK #ditjenppkl 1 1 1 1 1 1",11-10-2021 16:09,0,0,0,https://x.com/KLH_BPLH/status/1447489631289626624
Air Selangor,Air Selangor Air Selangor @air_selangor · 463 kawasan terjejas dengan gangguan bekalan  air  tidak berjadual yang disebabkan oleh henti tugas Loji Rawatan  Air  Sungai Semenyih (LRA Sg. Semenyih) berikutan insiden  pencemaran  bau di Sungai Semenyih telah menerima bekalan  air  bersih sepenuhnya. #AirSelangor #1216SgSemenyih 4 4 4 20 20 20 29 29 29,17-12-2021 22:54,0,0,0,https://x.com/air_selangor/status/1471871428819501060
Seri Cendekiawan,Seri Cendekiawan Seri Cendekiawan @SCendekiawan · Obor-obor Velella velella atau turut dikenali sebagai 'by-the wind sailors' merupakan obor-obor beracun yang pernah terdampar di beberapa pantai di negara kita. 4 4 4 355 355 355 652 652 652,17-09-2021 13:43,0,0,0,https://x.com/SCendekiawan/status/1438755418629500930
kumparan,"kumparan kumparan @kumparan · Pencarian pesawat Sriwijaya  Air  SJ-182 yang jatuh pada Sabtu (9/1) terus dilakukan, baik melalui udara maupun penyelaman. Tim penyelam dari Koarmada I TNI AL, menemukan banyak sekali puing-puing pesawat yang berada di dalam  air .  #TopNews http:// 32 32 32 380 380 380 868 868 868",10-01-2021 17:17,0,0,0,https://x.com/kumparan/status/1348212279574073347
BPPSDM KKP,"BPPSDM KKP BPPSDM KKP @bppsdm_kp · @bppsdm_kp #BRSDM  melalui  @RISET_BUNGUS @pusriskel  , melakukan penelitian untuk penentuan seberapa jauh perubahan kondisi  pencemaran air  tanah terhadap  pencemaran  Cl dengan menggunakan metode GALDIT & DRASTIC. #KKPRebound #RisetdanSDMKP #MenteriKKP @kkpgoid @saktitrenggono @kusdiantoro77 1 1 1 5 5 5",03-11-2021 17:13,0,0,0,https://x.com/bppsdm_kp/status/1455840549898915841
punapibali,"punapibali punapibali @punapibali · INI BUKAN  AIR  TERJUN, TAPI AWAN TERJUN

Panorama yang bisa semeton nikmati dari Desa Songan B, Kintamani, Bangli

Source @alengkongbalicamp 9 9 9 118 118 118 316 316 316",18-03-2021 07:18,0,0,0,https://x.com/punapibali/status/1372341493772394496
BERNAMA TV,"BERNAMA TV BERNAMA TV @BernamaTV · Keadaan sebuah pesawat pejuang Hawk 108 milik Tentera Udara Diraja Malaysia (TUDM) yang terhempas di kawasan landasan Pangkalan Udara Butterworth, Pulau Pinang malam tadi.⁣  K. Ganeson 15 15 15 1.3K 1.3K 1.3K 1.5K 1.5K 1.5K",17-11-2021 09:14,0,0,0,https://x.com/BernamaTV/status/1460793504913772550
Rachmady Azis,"Rachmady Azis Rachmady Azis @RachmadyAzis · Rabu (6/10/2), R Azis luhkan makassar, klp Tello Jaya kel Tello Baru, suvey kondisis keramba yg terdampak dugaan  pencemaran air  sungai, masih terjadi kematian ikan,  DLHK akan lakukan pengecekan kejadian tsb. #GiatLuhkanSatminkalMaros #luhlapor #LuhkanMakassar 7 7 7",07-10-2021 07:14,0,0,0,https://x.com/RachmadyAzis/status/1445905292139450369
anor,anor anor @chlriedes · Siren Pelepasan  Air  Empangan sudah dibunyikan. Banjir besar is coming. 33 33 33 14K 14K 14K 17K 17K 17K,18-12-2021 23:56,0,0,0,https://x.com/chlriedes/status/1472249501125472262
Melo Tukang Sampah Berdasi,"Melo Tukang Sampah Berdasi Melo Tukang Sampah Berdasi @melosky_83 · Salam Hijau Peduli Limbah Septiktank.
Palembang Hijau peduli  pencemaran air .
Youtube : Tukang Sampah Berdasi #wcmampet #septiktank #rawatbumi #limbah #palembangterkini #palembang #yayasanseutastalipersahabatan #tukangsampahberdasi #composterprojectmerahputih",15-11-2021 23:09,0,0,0,https://x.com/melosky_83/status/1460278717700182019
P _Vera27,"P _Vera27 P _Vera27 @Vettyvera24 · Innalillahi , Merinding sekali, Baru 9 hari 2021 Tapi indonesia sudah berduka.. Semoga ini musibah yang Terahir.

 prya for Sriwijaya  Air #SJ182  Pontianak jakarta - pontianak Kepulauan Seribu 2 2 2 10 10 10 199 199 199",09-01-2021 21:16,0,0,0,https://x.com/Vettyvera24/status/1347910219548921857
BBC News Indonesia,"BBC News Indonesia BBC News Indonesia @BBCIndonesia · BREAKING NEWS! 
Pesawat Sriwijaya  Air  rute Jakarta-Pontianak dilaporkan 'hilang kontak', Sabtu (09/01), sekitar pukul 14.40 WIB.  https:// 68 68 68 1.3K 1.3K 1.3K 2.2K 2.2K 2.2K",09-01-2021 17:31,0,0,0,https://x.com/BBCIndonesia/status/1347853442228887553
GELORA NEWS,"GELORA NEWS GELORA NEWS @geloraco · Keterlaluan! Gara-gara Pilot Sriwijaya  Air  Berpeci Putih, Capt Afwan Diumpat Kadrun Keterlaluan! Gara-gara Pilot Sriwijaya Air Berpeci Putih, Capt Afwan Diumpat Kadrun 287 287 287 432 432 432 1.1K 1.1K 1.1K",10-01-2021 19:15,0,0,0,https://x.com/geloraco/status/1348242010818285573
Pusyantek BRIN (Innotechs),"Pusyantek BRIN (Innotechs) Pusyantek BRIN (Innotechs) @PusyantekBRIN · Upaya untuk mengendalikan  pencemaran , salah satunya adalah pemantauan kualitas  air  baik yang akan masuk ke sungai, atau di lokasi aliran sungai. 
Inovasi online monitoring (ONLIMO) pengendalian  pencemaran  lahan, perairan dan udara adalah kontribusi nyata untuk kualitas lingkungan 1 1 1 2 2 2 3 3 3",02-12-2021 11:27,0,0,0,https://x.com/PusyantekBRIN/status/1466262651789398021
rizaamrou,"rizaamrou rizaamrou @commentyapper · Punca mata  air ,  air  terjun.
I had always believed it came from a small pool of water, but never imagined this. 
Nature; both beautiful and deadly. 26 26 26 9K 9K 9K 12K 12K 12K",01-12-2021 17:23,0,0,0,https://x.com/commentyapper/status/1465990038202707969
TNI Angkatan Udara,"TNI Angkatan Udara TNI Angkatan Udara @_TNIAU · @_TNIAU Hal ini akan mengakibatkan terjadinya proses kondensasi dadakan yang nantinya akan membentuk awan sepanjang rute pesawat tersebut.

Semakin ekstrim suhu sekitar (misal di negara yang sedang musim dingin), semakin tebal jejak awan yang terbentuk. 6 6 6 62 62 62 278 278 278",19-07-2021 15:46,0,0,0,https://x.com/_TNIAU/status/1417043095942696965
Tifatul Sembiring,"Tifatul Sembiring Tifatul Sembiring @tifsembiring · Ya Allah Ya Rahiim, semoga Engkau selamatkan seluruh penumpangnya. Amien YRA https:// 80/pesawat-sriwijaya-air-jakarta-pontianak-hilang-kontak … 29 29 29 87 87 87 594 594 594",09-01-2021 17:46,0,0,0,https://x.com/tifsembiring/status/1347857154020044802
BERNAMA,"BERNAMA BERNAMA @bernamadotcom · Pihak berkuasa Indonesia hari ini menemui serpihan dan barangan berupa bag, dipercayai dari pesawat  #SriwijayaAir   yang terhempas di perairan Kepulauan Seribu,  #Jakarta   semalam. 190 190 190 269 269 269",10-01-2021 12:11,0,0,0,https://x.com/bernamadotcom/status/1348135370764943360
Astro AWANI,"Astro AWANI Astro AWANI @501Awani · Pesawat komersial Sriwijaya  Air  yang dalam penerbangan dari Jakarta ke Pontianak dilaporkan hilang dari radar, lapor portal  http:// .

Pesawat tersebut dilaporkan terputus hubungan ketika melalui di daerah Kepulauan Seribu, Jakarta.
⁠ #HapusCOVID19 43 43 43 2.8K 2.8K 2.8K 2.8K 2.8K 2.8K",09-01-2021 17:42,0,0,0,https://x.com/501Awani/status/1347856238030118913
KKMalaysia,"KKMalaysia KKMalaysia @KKMPutrajaya · Kenyataan akhbar Kementerian Kesihatan Malaysia 

Kepentingan sistem pengudaraan dan kualiti udara yang baik bagi membendung penularan COVID-19. 

Bangunan yang mempunyai pengudaraan semula jadi mempunyai risiko rendah penularan COVID-19. 2 2 2 130 130 130 232 232 232",22-09-2021 19:20,0,0,0,https://x.com/KKMPutrajaya/status/1440652339795222528
Indah Water Konsortium (IWK),"Indah Water Konsortium (IWK) Indah Water Konsortium (IWK) @IwkComms · Sekiranya seseorang terdedah kepada  pencemaran  dan penyakit bawaan  air , kebarangkalian untuk mendapat penyakit cirit birit adalah sangat tinggi dan mungkin akan mengakibatkan kolera, tifoid atau hepatitis A serta mungkin boleh berakhir dengan kematian. 1 1 1 1 1 1 1 1 1",28-10-2021 17:01,0,0,0,https://x.com/IwkComms/status/1453663261992251399
BBWS Serayu Opak,BBWS Serayu Opak BBWS Serayu Opak @pu_sda_so · Pencegahan  Pencemaran Air  Perlukan Upaya Pengendalian  https:// yuopak/pencegahan-pencemaran-air-perlukan-upaya-pengendalian/ … 1 1 1,15-11-2021 17:08,0,0,0,https://x.com/pu_sda_so/status/1460188000676024320
Irfan_newboys,"Irfan_newboys Irfan_newboys @Marchfoward · Salah satu pesawat CN-235 Tentera Udara Diraja Malaysia (TUDM) sedang dinaik taraf sebagai pesawat pemantau maritim di Hangar PTDI-Dirgantara Indonesia

Pesawat ini salah satu dari 3 pesawat yg dirancang naik tarafnya bawah Program Khas Pentagon US

Kredit gambar : Fahmioedin 6 6 6 58 58 58 299 299 299",11-08-2021 09:30,0,0,0,https://x.com/Marchfoward/status/1425283434495176705
Kementerian Alam Sekitar dan Air,Kementerian Alam Sekitar dan Air Kementerian Alam Sekitar dan Air @KASA_MALAYSIA · Kenyataan media Kementerian Alam Sekitar dan  Air  (KASA) berkenaan Kilang Berasaskan Makanan Dikenakan Tindakan Henti Operasi Disyaki Punca  Pencemaran  Sebatian Penyebab Bau atau Odor Causing Substances (OCS) di Sungai Semenyih. 1 1 1 4 4 4,05-09-2021 09:24,0,0,0,https://x.com/KASA_MALAYSIA/status/1434341710054653956
dita,dita dita @APHRODlTA · @APHRODlTA 15. pelarungan = penenggelaman jenazah / abunya di laut 4 4 4 9 9 9 400 400 400,10-06-2021 17:45,0,0,0,https://x.com/APHRODlTA/status/1402939875221938176
Dato' Ir. Izham Hashim,"Dato' Ir. Izham Hashim Dato' Ir. Izham Hashim @IrIzhamHashim · Alhamdullilah, isu  pencemaran  hentitugas di Loji Rawatan  Air  Sungai Semenyih telah berjaya diselesaikan oleh pihak  Air  Selangor. Air Selangor Air Selangor @air_selangor · Air Selangor ingin memaklumkan bahawa bacaan tahap 0 TON sebanyak tiga kali berturut-turut telah direkodkan di Sungai Semenyih yang mana telah membolehkan Loji Rawatan Air (LRA) Sg. Semenyih untuk mula beroperasi. 

Klik di sini  1 1 1 2 2 2 9 9 9",31-08-2021 22:38,0,0,0,https://x.com/IrIzhamHashim/status/1432729415557869570
Harian Kompas,"Harian Kompas Harian Kompas @hariankompas · Operasional pabrik tepung di Kabupaten Karawang, Jawa Barat, dihentikan sementara karena dinilai mencemari Daerah Aliran Sungai (DAS) Cilamaya. Akibat  pencemaran  itu,  air  sungai berwarna hitam dan berbau.  #Nusantara #AdadiKompas https:// /2021/10/05/cemari-sungai-operasional-pabrik-tepung-di-karawang-dihentikan-wagub-jabar/?utm_source=medsos_twitter&utm_medium=link … 1 1 1 2 2 2",06-10-2021 06:30,0,0,0,https://x.com/hariankompas/status/1445531749048410116
Khairul Aqmal,Khairul Aqmal Khairul Aqmal @KhairulAqmal · Lembah Klang ada  pencemaran air  lagi. Simpan  air  guys. 1 1 1,16-12-2021 11:57,0,0,0,https://x.com/KhairulAqmal/status/1471343620946944002
Nabeel,"Nabeel Nabeel @NabeelZuhairi · @NabeelZuhairi Engineer tu kata lagi, Selangor makin kurang sumber  air  sungai. Tambah pula dengan  pencemaran ,  air  bersih makin berkurangan.  Air  bawah tanah mungkin akan lebih banyak dipam macam Jakarta. Banjir makin kerap. 10 10 10 24 24 24",18-12-2021 21:46,0,0,0,https://x.com/NabeelZuhairi/status/1472216598719074307
Amirudin Shari,"Amirudin Shari Amirudin Shari @AmirudinShari · Jabatan Alam Sekitar (JAS) akan menahan beberapa individu bagi membantu siasatan punca kejadian  pencemaran  bau di Sungai Semenyih sehingga menyebabkan gangguan bekalan  air  tidak berjadual baru-baru ini.

Tiada kompromi untuk jenayah sumber  air . https:// l/2021/09/859849/pencemaran-sungai-semenyih-beberapa-individu-akan-ditahan … 3 3 3 14 14 14 26 26 26",06-09-2021 13:04,0,0,0,https://x.com/AmirudinShari/status/1434759402439909382
Selwam Arjunan,"Selwam Arjunan Selwam Arjunan @SelwamNewsMPB · Sebuah pesawat tentera dipercayai terhempas di Pangkalan Udara  @tudm_rasmi  di Butterworth, Pulau Pinang kira-kira jam 11 malam. Maklumat tidak rasmi menyatakan seorang terkorban, manakala seorang lagi cedera, namun belum dapat disahkan. Maklumat lanjut menyusul.  @BuletinTV3 4 4 4 221 221 221 189 189 189",16-11-2021 22:32,0,0,0,https://x.com/SelwamNewsMPB/status/1460631917338894338
Shimizu Indonesia,"Shimizu Indonesia Shimizu Indonesia @Shimizu_Indo · Air  yang sudah tercemar dapat meningkatkan resiko terjadinya berbagai masalah kesehatan. Oleh sebab itu kamu perlu mengenali
penyakit berbahaya  pencemaran air  bagi kesehatan seperti :

1. Hepatitis A
Virus ini menyebabkan gejalah berupa mata dan kulit berwarna kekuningan. 2 2 2 2 2 2",23-09-2021 16:05,0,0,0,https://x.com/Shimizu_Indo/status/1440965421830598663
CNN Indonesia,CNN Indonesia CNN Indonesia @CNNIndonesia · Pemerintah Restui Pesawat Terisi 100 Persen Saat PPKM Pemerintah Restui Pesawat Terisi 100 Persen Saat PPKM 199 199 199 430 430 430 313 313 313,12-01-2021 07:52,0,0,0,https://x.com/CNNIndonesia/status/1348794998200811520
Merdeka.com,"Merdeka.com Merdeka.com @merdekadotcom · Telusuri Sumber  Pencemaran  Parasetamol, Dinas LH Uji Sampel  Air  Teluk Jakarta  http:// 3 3 3",03-10-2021 14:08,0,0,0,https://x.com/merdekadotcom/status/1444559853213523971
uma,"uma uma @pearlyraiin · everyone who has friends and family members aboard the jakarta-pontianak sriwijaya  air , my thoughts and prayers are with you, and im wishing the best for the crew and passengers 365 365 365 300 300 300",09-01-2021 18:09,0,0,0,https://x.com/pearlyraiin/status/1347862966419378176
Harian Kompas,"Harian Kompas Harian Kompas @hariankompas · Belum selesai upaya Pemprov DKI Jakarta atasi polusi udara, muncul  pencemaran  parasetamol di Teluk Jakarta. Tugas berat memelihara  air  & udara bersih Jakarta harus dipahami sebagai konsekuensi logis kepadatan warga Ibu Kota.  #Opini #Tajuk #AdadiKompas https:// 1/10/06/elegi-parasetamol-di-teluk-jakarta/?utm_source=medsos_twitter&utm_medium=link … 1 1 1",06-10-2021 08:10,0,0,0,https://x.com/hariankompas/status/1445556914486530058
tempo.co,"tempo.co tempo.co @tempodotco · Soal  Pencemaran , Pemkot Tangerang Selatan Tunggu Uji Sampel  Air  Sungai Cisadane  https:// oal-pencemaran-pemkot-tangerang-selatan-tunggu-uji-sampel-air-sungai-cisadane?utm_source=Twitter&utm_medium=Digital%20Marketing&utm_campaign=dlvrit … #TempoMetro 1 1 1",09-10-2021 17:02,0,0,0,https://x.com/tempodotco/status/1446778132472553473
tempo.co,tempo.co tempo.co @tempodotco · PT Mayora Indah Jayanti mengklaim produsen makanan dan minuman itu tidak ikut andil dalam  pencemaran air  permukaan atau  air  sungai di sekitar pabrik tersebut.  #TempoMetro https:// 4 4 4 2 2 2,08-10-2021 13:49,0,0,0,https://x.com/tempodotco/status/1446367163997032452
BERNAMA,"BERNAMA BERNAMA @bernamadotcom · Pihak berkuasa tempatan Kepulauan Seribu dan nelayan menemui serpihan di perairan Kepulauan Seribu, Jakarta, selepas nelayan kawasan itu mendakwa melihat sebuah pesawat terhempas di perairan berkenaan. 

Setakat ini belum ada makluman rasmi dari pihak berkuasa Indonesia. 1 1 1 137 137 137 161 161 161",09-01-2021 18:40,0,0,0,https://x.com/bernamadotcom/status/1347870853531201538
Bukan Mulyadi Tukang Sarungin Pohon,"Bukan Mulyadi Tukang Sarungin Pohon Bukan Mulyadi Tukang Sarungin Pohon @dusrimulya · Gua curiga keputusan ""Wajib PCR naik pesawat"" itu karena dua hal

1. Pandemi Melandai
2. Alat PCR menumpuk

Dua hal diatas punya hubungan sebab akibat

Pandemi melandai --> Alat PCR menumpuk --> Pemain Besar merugi --> Ada yg gak kebagian cuan 122 122 122 927 927 927 2.4K 2.4K 2.4K",24-10-2021 12:40,0,0,0,https://x.com/dusrimulya/status/1452148094439620609
Harian Kompas,"Harian Kompas Harian Kompas @hariankompas · Warga Surabaya ( @BanggaSurabaya ) boleh bangga karena mendapat penghargaan kota dengan udara terbersih di Asia Tenggara. Namun, di sisi lain,  pencemaran air  dan tanah perlu mendapat perhatian dan penanganan.  #Nusantara #AdadiKompas @s03bro @swetta_pandia https:// /2021/10/22/udara-surabaya-diklaim-terbersih-di-asia-tenggara?utm_source=medsos_twitter&utm_medium=link … 5 5 5 2 2 2",22-10-2021 21:30,0,0,0,https://x.com/hariankompas/status/1451556447364452352
Investor Daily,"Investor Daily Investor Daily @InvestorID · Temuan  Pencemaran  Paracetamol, DKI Ambil Sampel  Air  Laut Teluk Jakarta  https://",04-10-2021 14:12,0,0,0,https://x.com/InvestorID/status/1444923339915415557
Jawa Pos,Jawa Pos Jawa Pos @jawapos · Ahli: Sumber  Air  yang Sehat Harus Terhindar dari  Pencemaran  Lingkungan  https:// 1/2021/ahli-sumber-air-yang-sehat-harus-terhindar-dari-pencemaran-lingkungan/ …,19-11-2021 13:57,0,0,0,https://x.com/jawapos/status/1461589449280679940
Globalresourcestrader Corporation,"Globalresourcestrader Corporation Globalresourcestrader Corporation @MarineCulture · 14 OCT 2021.
EVALUASI KUALITAS PAKAN GRT-C

Mutu pakan ikan dapat diketahui dengan cara pengujian kualitas;
i. Pengujian fisik,
ii. Daya tahan hasil cetakan didalam  air  (water stability),
iii. Tingkat  pencemaran air  di lingkungan budidaya ikan (kondisi  air ). @BudidayaKKP DR. AMI KARMILA and 4 others DR. AMI KARMILA DR. AMI KARMILA 3 3 3",14-10-2021 23:39,0,0,0,https://x.com/MarineCulture/status/1448689860902998016
Kompas.com,"Kompas.com Kompas.com @kompascom · ""Kondisi muka saya hancur total,"" kata Stella Monica, terdakwa kasus  pencemaran  nama baik klinik kecantikan di Surabaya. |  #Regional https:// 9/052230578/berlinang-air-mata-terdakwa-pencemaran-nama-baik-klinik-kecantikan-di … . regional.kompas.com regional.kompas.com Berlinang Air Mata, Terdakwa Pencemaran Nama Baik Klinik Kecantikan di Surabaya: Muka Saya Hancur... Berlinang Air Mata, Terdakwa Pencemaran Nama Baik Klinik Kecantikan di Surabaya: Muka Saya Hancur... Dia mengaku beberapa kali mengeluh kepada dokter di klinik tersebut, tetapi tidak mendapatkan tanggapan baik. Dia mengaku beberapa kali mengeluh kepada dokter di klinik tersebut, tetapi tidak mendapatkan tanggapan baik. 2 2 2 4 4 4 12 12 12",29-10-2021 06:55,0,0,0,https://x.com/kompascom/status/1453872961124016128
Joel Picard,"Joel Picard Joel Picard @sociotalker · this is actually a great policy that will have a big impact on many low-income families in jakarta. it should be followed by other cities in Indonesia where clean water remains a privilege. Turunkan Tarif Air Pam dari Rp25 Ribu Jadi Rp1.050, Anies: Untuk Keadilan Sosial 127 127 127 535 535 535 1.9K 1.9K 1.9K",06-09-2021 14:02,0,0,0,https://x.com/sociotalker/status/1434773960462254081
Merdeka.com,Merdeka.com Merdeka.com @merdekadotcom · Sikap Anies saat Disinggung soal Pilpres 2024 dan  Pencemaran Air  di Teluk Jakarta  http://,04-10-2021 14:46,0,0,0,https://x.com/merdekadotcom/status/1444931806822760449
Harian Kompas,"Harian Kompas Harian Kompas @hariankompas · Akses warga terhadap sanitasi di Jakarta terus membaik. Namun, tingkat  pencemaran air  tanah dan  air  permukaan di Ibu Kota masih tinggi. Septic tank warga dinilai jadi sumber  pencemaran .  #Metropolitan #AdadiKompas @ato_vanto https:// 1/11/01/jalan-tengah-pemenuhan-sanitasi-aman-kawasan-urban?utm_source=medsos_twitter&utm_medium=link …",01-11-2021 13:45,0,0,0,https://x.com/hariankompas/status/1455063304481558531
Koran Tempo,Koran Tempo Koran Tempo @korantempo · Dinas Lingkungan Hidup dan Laboratorium Kesehatan Daerah Pemerintah Provinsi DKI Jakarta melanjutkan penelusuran dugaan  pencemaran  limbah farmasetika di Teluk Jakarta. Mereka telah mengambil sampel  air  baru dari tiga aliran sungai yang…  https:// 637/dki-telusuri-limbah-parasetamol-di-dekat-industri-farmasi?utm_source=Digital%20Marketing&utm_medium=Twitter&utm_campaign=dlvrit … #KoranTempo,12-10-2021 03:38,0,0,0,https://x.com/korantempo/status/1447662928258232321
tvOnenews,"tvOnenews tvOnenews @tvOneNews · Protes  Pencemaran Air , Warga Bakar Truk Petroperu  http:// 1 1 1 1 1 1 2 2 2",22-11-2021 14:50,0,0,0,https://x.com/tvOneNews/status/1462689828080783362
Yan A. Harahap (𝐘 𝐀 𝐇),"Yan A. Harahap (𝐘 𝐀 𝐇) Yan A. Harahap (𝐘 𝐀 𝐇) @YanHarahap · Pemborosan. Rezim ini benar2 ‘bermental pemboros’. Kalau alasannya hanya karena sudah direncanakan dari 2019, kan bisa ditunda dulu, sampai kondisi bangsa yang lagi ‘krisis’, membaik. Gak punya sense of crisis. Rakyat lebih membutuhkan. news.detik.com news.detik.com Istana Jawab Anggapan Foya-foya Cat Ulang Pesawat Kepresidenan Istana Jawab Anggapan Foya-foya Cat Ulang Pesawat Kepresidenan ""Dapat dijelaskan, bahwa pengecatan pesawat ini telah direncanakan sejak tahun 2019,"" kata Kepala Sekretariat Presiden, Heru Budi Hartono. ""Dapat dijelaskan, bahwa pengecatan pesawat ini telah direncanakan sejak tahun 2019,"" kata Kepala Sekretariat Presiden, Heru Budi Hartono. 21 21 21 57 57 57 172 172 172",04-08-2021 08:47,0,0,0,https://x.com/YanHarahap/status/1422735833702932480
Bie,"Bie Bie @febieegusfa · Itu masuk ke CAT (clear  air  turbulence), gk bisa dideteksi di radar..kejadiannya biasanya cm beberapa detik tapi bikin onar isi pesawat  ..makanya seatbelt itu penting, at least kitanya meminimalisasi kemungkinan cedera Nuna JK Nuna JK @jeonnaerinda_jk · @febieegusfa @febieegusfa Kalo pesawatnya cmn goyang gtu aja aku udh biasa, tpi prnh skli dri batam ke jkt pesawat yg aku naikin itu tb2 aja turun ketinggian kyk hmpir terjun aja gtu ke bwh, tpi alhamdulillah itu cmn beberapa menit hbs itu pesawat normal lgi, asli udh syok mikir pesawatku bkal jatuh 26 26 26 30 30 30 644 644 644",09-01-2021 22:40,0,0,0,https://x.com/febieegusfa/status/1347931158479130625
ᥫ᭡ Cheiisy,"ᥫ᭡ Cheiisy ᥫ᭡ Cheiisy @sukaexo9 · Teman2 exol semua mari kita doakan keselamatan penumpang pesawat sriwijaya  air  yang melakukan penerbangan dari Jakarta ke Pontianak,semoga semua penumpang dan awak pesawat diberikan keselamatan amin  #SJ182 16 16 16 174 174 174 882 882 882",09-01-2021 18:46,0,0,0,https://x.com/sukaexo9/status/1347872312066928643
Haedar Nashir,"Haedar Nashir Haedar Nashir @HaedarNs · Turut berduka cita atas hilangnya pesawat Sriwijaya  Air   SJ 182 rute Jakarta-Pontianak.
Semoga diberikan kemudahan dan kelancaran dalam proses evakusi. Republika.co.id Republika.co.id @republikaonline · Basarnas masih mencari posisi tepat keberadaan pesawat Sriwijaya Air SJY 182  http://republika.co.id/berita//qmo2xp354/basarnas-masih-cari-posisi-tepat-pesawat-sriwijaya-air… http:// 354/basarnas-masih-cari-posisi-tepat-pesawat-sriwijaya-air … 37 37 37 192 192 192",09-01-2021 20:55,0,0,0,https://x.com/HaedarNs/status/1347904857403846659
Mustafa Akmal™,"Mustafa Akmal™ Mustafa Akmal™ @mustafaakmal_ · Babi apa la  Air  Selangor ni pukimak anak haram betul.  Pencemaran  bau henti tugas, kemarau henti tugas, ni banjir,  air  melimpah ruah pun henti tugas. Pergi mampus jela  Air  Selangor anak haram oiiii Air Selangor Air Selangor @air_selangor · Air Selangor ingin memaklumkan LRA Langat 2 dan LRA Cheras Batu 11 terpaksa dihenti tugas manakala LRA Sg Langat beroperasi pada pengeluaran separa berikutan peningkatan paras sungai yang mengakibatkan banjir. 1 1 1 21 21 21 5 5 5",19-12-2021 11:52,0,0,0,https://x.com/mustafaakmal_/status/1472429590773518336
Tuan Ibrahim Tuan Man,"Tuan Ibrahim Tuan Man Tuan Ibrahim Tuan Man @titm_official · Dpd KP  @jasmalaysia , punca  pencemaran  bau Sg Semenyih sdg disiasat oleh pasukan Ops Sumber  Air , Selangor. Terdapat suspek premis dikenalpasti lepaskan sisa berminyak ke sungai. Siasatan masih diteruskan & akan dikemaskini dari semasa ke semasa oleh  @span_malaysia  &  @air_selangor 11 11 11 60 60 60",16-12-2021 13:20,0,0,0,https://x.com/titm_official/status/1471364644610580486
kumparan,kumparan kumparan @kumparan · Kebijakan pemerintah mewajibkan PCR untuk naik pesawat dinilai janggal. Diduga ada kepentingan bisnis.  https:// /pcr-jadi-syarat-wajib-naik-pesawat-ini-sejumlah-kejanggalannya-1wmtSpmIHbo?utm_medium=post&utm_source=Twitter&utm_campaign=int … 30 30 30 101 101 101 214 214 214,25-10-2021 08:49,0,0,0,https://x.com/kumparan/status/1452452108267966464
