username,tweet,waktu,likes,retweets,replies,tweet_link
Aid Fawzal,"Aid Fawzal Aid Fawzal @AidFawzal · Yang membolehkan satu kapal terbang tu terbang adalah apabila seluruh badannya menujah ke depan (thrust) dan angin lalu pada sayapnya. Ia bukan terbang sebab kelajuan tayar berpusing. 

Jom kita teroka dengan lebih terperinci bagaimana ia terbang tapi secara santai.... Abang Butter Abang Butter @ArepZenol · Salam Dr.  @AidFawzal @AidFawzal  . Boleh dr. terangkan dengan lebih terperinci? Adakah kapal ni dapat terbang atau tidak? Mohon pencerahan 8 8 8 337 337 337 749 749 749",03-01-2022 08:29,0,0,0,https://x.com/AidFawzal/status/1477814426971652108
Utusan Malaysia,Utusan Malaysia Utusan Malaysia @UMonline · Lebih sejuta mungkin alami gangguan bekalan  air  tidak berjadual akibat  pencemaran  bau dikesan di stesen Jenderam Hilir hari ini  https:// /lra-henti-tugas-472-kawasan-terjejas-bekalan-air/ … 1 1 1 2 2 2 12 12 12 2K 2K 2K,24-12-2022 08:26,0,0,0,https://x.com/UMonline/status/1606461226049015811
beritajatim,"beritajatim beritajatim @beritajatimcom · Pemkot Kediri Libatkan Semua Kelurahan Dalam Sosialisasi  Air  Limbah.

Sebagai upaya membuka wawasan masyarakat tentang dampak adanya  pencemaran air  limbah domestik, Pemerintah Kota…  http:// #PolitikPemerintahan #CegahPencemaranLingkungan  via  @beritajatimcom",14-12-2022 09:10,0,0,0,https://x.com/beritajatimcom/status/1602848486009241600
Buletin TV3,Buletin TV3 Buletin TV3 @BuletinTV3 · PENCEMARAN  BAU |  Bekalan  Air  Di 472 Kawasan Pulih Sepenuhnya  https:// g6JxQ&feature=shares … 2 2 2 2.1K 2.1K 2.1K,27-12-2022 12:52,0,0,0,https://x.com/BuletinTV3/status/1607615426422517766
Kami KEADILAN,"Kami KEADILAN Kami KEADILAN @kamikeadilan · Pulau Pinang bakal mempunyai 'Teksi  Air ' yang moden.

Ini bertujuan untuk memudahkan transit harian awam di antara tanah besar dan pulau serta menjadi salah satu tarikan pelancongan di negeri Pulau Pinang.

Selanjutnya:  https:// akal-mempunyai-teksi-air-moden/ … 6 6 6 72 72 72 225 225 225",13-12-2022 21:45,0,0,0,https://x.com/kamikeadilan/status/1602675972473774080
Kompas.com,Kompas.com Kompas.com @kompascom · Pemkot Jakarta Utara meminta masyarakat mengelola sarana MCK dengan baik untuk menghindari  pencemaran  bakteri Escherichia coli pada  air  tanah.  http://,29-09-2022 16:50,0,0,0,https://x.com/kompascom/status/1575422697710186496
NusaBali.com,NusaBali.com NusaBali.com @nusabalicom · Ungkap Krisis  Air  dan  Pencemaran https:// #Pencemaran #berita #nusabali #PameranLukisan,05-11-2022 11:49,0,0,0,https://x.com/nusabalicom/status/1588755477307199489
Wan Arief Imran,"Wan Arief Imran Wan Arief Imran @wanariefimran · Baca data tu elok-elok la sikit. Line kuning tu speed. Line biru tu baru altitude. Nampak macam controlled descend. Benda macam ni, Boeing, Airbus, kapal apa pun boleh jadi. Pilots are well trained to handle it. In the end, semua selamat.

Apa pun, tunggu  @MAS  keluar statement.  https:// /OrenjiRenOren/status/1510816826128691203 … This post is unavailable. 7 7 7 203 203 203 221 221 221",04-04-2022 19:38,0,0,0,https://x.com/wanariefimran/status/1510960034477674496
Free Malaysia Today,"Free Malaysia Today Free Malaysia Today @fmtoday · Loji Rawatan  Air  ditutup kerana  pencemaran  bau, kata exco Selangor  #FMTNews https:// a/tempatan/2022/12/02/loji-rawatan-air-ditutup-kerana-pencemaran-bau-kata-exco-selangor/ … 2 2 2 6 6 6",02-12-2022 18:57,0,0,0,https://x.com/fmtoday/status/1598647478668374017
Free Malaysia Today,"Free Malaysia Today Free Malaysia Today @fmtoday · Insiden  pencemaran  bau, 472 kawasan di Selangor alami gangguan bekalan  air #FMTNews https:// a/tempatan/2022/12/24/insiden-pencemaran-bau-472-kawasan-di-selangor-alami-gangguan-bekalan-air/ … 1 1 1 3 3 3 3.1K 3.1K 3.1K",24-12-2022 07:43,0,0,0,https://x.com/fmtoday/status/1606450372029317120
Irfan_newboys,"Irfan_newboys Irfan_newboys @Marchfoward · RASMI

Disahkan Juruterbang pesawat ini meninggal dunia

Beliau dikenali sbg Leftenan Satu Penerbangan Tempur Safitra Indra Wahyudi maklum Ketua Penerangan Skuadron 15 Udara TNI-AU, Kapten Sus Yudha Pramono Irfan_newboys Irfan_newboys @Marchfoward · TERKINI

Pesawat T-50 milik Tentera Nasional Indonesia Angkatan Udara terhempas di Blora, Jawa Tengah 2 2 2 138 138 138 303 303 303",19-07-2022 09:34,0,0,0,https://x.com/Marchfoward/status/1549221151246667776
Astro AWANI,Astro AWANI Astro AWANI @501Awani · Ia susulan henti tugas Loji Rawatan  Air  (LRA) Sungai Semenyih dan LRA Bukit Tampoi berikutan insiden  pencemaran  bau di Stesen Pam  Air  Mentah Jenderam Hilir. #AWANInews #AWANIpagi astroawani.com astroawani.com 472 kawasan di lima daerah Selangor alami gangguan air 472 kawasan di lima daerah Selangor alami gangguan air Gangguan air itu susulan henti tugas Loji Rawatan Air (LRA) Sungai Semenyih dan LRA Bukit Tampoi berikutan insiden pencemaran bau di Stesen Pam Air Mentah Jenderam Hilir. Gangguan air itu susulan henti tugas Loji Rawatan Air (LRA) Sungai Semenyih dan LRA Bukit Tampoi berikutan insiden pencemaran bau di Stesen Pam Air Mentah Jenderam Hilir. 3 3 3 27 27 27 27 27 27 23K 23K 23K,24-12-2022 07:43,0,0,0,https://x.com/501Awani/status/1606450424785309696
Kosmo! Online,Kosmo! Online Kosmo! Online @kosmo_online · Kerana dibimbangi mendatangkan  pencemaran air https:// aka-tolak-50-permohonan-lanjutan-milikan-tanah-di-empangan/ … 1 1 1 3 3 3,15-12-2022 18:29,0,0,0,https://x.com/kosmo_online/status/1603351449907462145
Riza Hariati/热依扎,"Riza Hariati/热依扎 Riza Hariati/热依扎 @rizahariati · Bagi orang2 yg dirugikan oleh  pencemaran  udara,  air , dan suara dari  #umkm , harus ngomong sekarang.

Saya cuma  pencemaran  udara dari restoran tetangga sebelah rumah.

Bayangin kalo  #umkm  nya kandang ayam. Selamat menciun baunya, berisiknya.
Kalo umkm nya tekstil, bisa  air  juga AA LaNyalla MM AA LaNyalla MM @LaNyallaMM1 · Saya mengajak para kepala daerah untuk menggenjot produksi Usaha Mikro Kecil dan Menengah (UMKM) di daerah masing-masing. Dorongan kepala daerah menghidupkan UMKM dengan kebijakan atau regulasi yang tepat merupakan sebuah langkah penting. 1 1 1",22-10-2022 05:45,0,0,0,https://x.com/rizahariati/status/1583590374857064448
Buletin TV3,"Buletin TV3 Buletin TV3 @BuletinTV3 · Menteri Sumber Asli, Alam Sekitar dan Perubahan Iklim, Nik Nazmi Nik Ahmad memberi jaminan dua loji rawatan  air  (LRA) yang dihenti tugas akibat  pencemaran , sehingga mengakibatkan gangguan bekalan  air , akan dipulihkan secepat mungkin.  https:// 1 1 1 1 1 1 3 3 3 2.2K 2.2K 2.2K",24-12-2022 11:20,0,0,0,https://x.com/BuletinTV3/status/1606505038804930567
Kosmo! Online,Kosmo! Online Kosmo! Online @kosmo_online · Gangguan itu ekoran henti tugas sementara Loji Rawatan  Air  (LRA) Sungai Semenyih dan LRA Bukit Tampoi selepas insiden  pencemaran  bau di Stesen Pam  Air  Mentah Jenderam Hilir.  https:// a-wilayah-472-kawasan-terjejas-bekalan-air/ … 3 3 3 6 6 6 1.1K 1.1K 1.1K,24-12-2022 07:32,0,0,0,https://x.com/kosmo_online/status/1606447786957967361
Utusan Malaysia,"Utusan Malaysia Utusan Malaysia @UMonline · ""Hasil lawatan mendapati  pencemaran  sumber  air  berlaku kerana kaedah penternakan dan kawalan  pencemaran  konvensional iaitu bukan kaedah penternakan tertutup seperti kaedah Modern Pig Farming.  https:// /pengusaha-ternakan-babi-tanjung-sepat-diarah-bersih-ladang-sistem-kumbahan/ … 1 1 1 1 1 1 3 3 3",28-09-2022 10:30,0,0,0,https://x.com/UMonline/status/1574964626550398976
AIR ;KEMASAN,"AIR ;KEMASAN AIR ;KEMASAN @mineraleeeeeee · @worksfess Agung sedayu group, alam sutera realty, sinarmas, agung podomoroland, mnc tv, sriwijaya  air 26 26 26 48 48 48 386 386 386",21-11-2022 10:49,0,0,0,https://x.com/mineraleeeeeee/status/1594538355894546432
Media Selangor,"Media Selangor Media Selangor @Media_Selangor · LUAS pantau rapi  pencemaran  bau di stesen pam  air  mentah Jenderam Hilir Sisa pencemaran pati minyak wangi dikesan, jangka dialir dalam masa empat jam - Selangorkini 2 2 2 1K 1K 1K",31-12-2022 21:33,0,0,0,https://x.com/Media_Selangor/status/1609195939964813312
pendapat,"pendapat pendapat @pendapatmy · Selamatkan sumber  Dend  atas pihak yang mengakibatkan  pencemaran  di sumber  air  bakal dinaikkan 2,500 kali ganda bagi melindungi sumber yang berharga itu.

Ikuti   ini.

Apa pendapat anda mengenai usaha ini? Dapat halang pencemaran Dapat halang pencemaran 50.1% Tak pasti, mungkin baik Tak pasti, mungkin baik 20.4% Tidak, mereka degil ‍ Tidak, mereka degil  ‍ 29.5% 1,055 votes 1,055 votes · · Final results Final results 3 3 3 7 7 7 42 42 42",19-09-2022 19:03,0,0,0,https://x.com/pendapatmy/status/1571832258130223106
Jamban Dari Syurga,"Jamban Dari Syurga Jamban Dari Syurga @eryazmi · @eryazmi @amiralfateh and and @pudynzayn - pencemaran  bukan bawah skop AS
- pencemaran  bawah skop JAS kerajaan PUSAT
- pencemaran  dilakukan oleh orang awam, bukan AS

AS takda  air  sebab paip/valve pecah:
-ada notis kecemasan
-selalunya siap dalam 2jam-2hari
-AS selalu ada backup pipes & valves untuk ganti 6 6 6 488 488 488 960 960 960",20-11-2022 02:54,0,0,0,https://x.com/eryazmi/status/1594056562360094720
SinarHarian,"SinarHarian SinarHarian @SinarOnline · Bimbang akan menyebabkan  air  sungai terjejas, berlaku  pencemaran . https:// 3 3 3 1 1 1",02-11-2022 15:42,0,0,0,https://x.com/SinarOnline/status/1587726894283182080
Tribun Jogja,"Tribun Jogja Tribun Jogja @tribunjogja · Pencemaran  Makin Masif, Indeks Kualitas  Air  Sungai di Kota Yogyakarta Terus Merosot  https:// 1 1 1",28-09-2022 20:07,0,0,0,https://x.com/tribunjogja/status/1575109847342874625
Media Selangor,Media Selangor Media Selangor @Media_Selangor · Status bacaan  pencemaran  bau di dua Loji Rawatan  Air  (LRA) yang dihenti tugas semalam masih tidak selamat untuk beroperasi semula  https:// -pencemaran-bau-di-dua-loji-masih-tidak-selamat/ … 1 1 1 924 924 924,25-12-2022 10:01,0,0,0,https://x.com/Media_Selangor/status/1606847517366288385
Media Selangor,"Media Selangor Media Selangor @Media_Selangor · Pengurusan  Air  Selangor Sdn Bhd ( Air  Selangor) melakukan ujian persampelan secara kerap bagi mengukur kualiti  air  yang terjejas kesan dari bahan sisa  pencemaran  bau di Stesen Pam  Air  Mentah Jenderam Hilir. selangorkini.my selangorkini.my Air Selangor lakukan ujian persampelan secara kerap, ukur kualiti air - Selangorkini Air Selangor lakukan ujian persampelan secara kerap, ukur kualiti air - Selangorkini SHAH ALAM, 24 DIS: Pengurusan Air Selangor Sdn Bhd (Air Selangor) melakukan ujian persampelan secara kerap bagi mengukur kualiti air yang terjejas kesan dari bahan sisa pencemaran bau di Stesen Pam... SHAH ALAM, 24 DIS: Pengurusan Air Selangor Sdn Bhd (Air Selangor) melakukan ujian persampelan secara kerap bagi mengukur kualiti air yang terjejas kesan dari bahan sisa pencemaran bau di Stesen Pam... 2 2 2 4 4 4 1.2K 1.2K 1.2K",24-12-2022 21:10,0,0,0,https://x.com/Media_Selangor/status/1606653501840494592
Buletin TV3,"Buletin TV3 Buletin TV3 @BuletinTV3 · Status pemulihan bekalan  air  di kawasan terjejas berikutan  pencemaran  bau di Stesen Pam  Air  Mentah Jenderam Hilir, sudah mencapai 95 peratus setakat jam 6 petang tadi. -  https:// uan-bekalan-air-di-selangor-sudah-95-peratus-pulih/ … 6 6 6 3.4K 3.4K 3.4K",26-12-2022 21:09,0,0,0,https://x.com/BuletinTV3/status/1607377968598339586
Buletin TV3,"Buletin TV3 Buletin TV3 @BuletinTV3 · Bekalan  air  di kawasan terjejas berikutan  pencemaran  bau di Stesen Pam  Air  Mentah Jenderam Hilir, sudah pulih sepenuhnya. https:// an-air-di-lima-wilayah-terjejas-pulih-sepenuhnya/#.Y6pFov2ICNQ.twitter … 1 1 1 6 6 6 2.3K 2.3K 2.3K",27-12-2022 08:08,0,0,0,https://x.com/BuletinTV3/status/1607544028568117248
Jamban Dari Syurga,"Jamban Dari Syurga Jamban Dari Syurga @eryazmi · Salam. Aku kerja bahagian maintenance  air  selangor meh sini aku nak kabo kebodohan2 penyokong PAS

Selangor takde  air  sebab isu  pencemaran . Siapa buat  pencemaran ? Publik

Kelantan  air  kotor sebab AKSB korup dari dulu. PAS buat bodoh, buat2 tak nampak. Itu bezanya  3 3 3 100 100 100 149 149 149",06-11-2022 18:03,0,0,0,https://x.com/eryazmi/status/1589211849559769089
SinarHarian,SinarHarian SinarHarian @SinarOnline · Kerajaan negeri melalui Lembaga Urus  Air  Selangor (LUAS) telah melaksanakan beberapa langkah serta-merta bagi menangani  pencemaran . https:// 1 1 1 9 9 9 20 20 20 6.7K 6.7K 6.7K,24-12-2022 20:45,0,0,0,https://x.com/SinarOnline/status/1606647327430971393
The Malaysian Insight,"The Malaysian Insight The Malaysian Insight @msianinsight · Pencemaran  bau jejas bekalan  air  di 472 kawasan, kata  Air  Selangor  https:// 4?utm_source=dlvr.it&utm_medium=twitter&utm_campaign=msianinsight … 1 1 1 1.5K 1.5K 1.5K",24-12-2022 09:25,0,0,0,https://x.com/msianinsight/status/1606476012682088452
Berita Harian,Berita Harian Berita Harian @bharianmy · #BHNasional  Penduduk dakwa  pencemaran air  punca beratus kilogram ikan dalam tali  air  sawah mati. https:// 1 1 1,04-10-2022 11:49,0,0,0,https://x.com/bharianmy/status/1577158977879539712
Jamban Dari Syurga,"Jamban Dari Syurga Jamban Dari Syurga @eryazmi · Last selangor takde  air  yang sampai >2 hari takde  air  ialah December 2020.

Jangan risau, projek saya dah selesaikan masalah  pencemaran  sumber  air  kat Selangor dah dekat 2 tahun sampai hari ni..... Engko ni sembang kuban kuban je la  shima shima @shimaaa23457 · @ekmalabdyllah @ekmalabdyllah and @AmalAjlaa @AmalAjlaa Tk la kakak sya duk kelantan air okay bersih? Selangor yg tkde air slalu tu mcmna? 2 2 2 7 7 7",20-11-2022 11:10,0,0,0,https://x.com/eryazmi/status/1594181478854053888
Getaran,"Getaran Getaran @getaranmy · Kerajaan Selangor sudah melaksanakan empat langkah serta-merta bagi menangani  pencemaran  bau di Stesen Pam  Air  Mentah Jenderam Hilir yang menyebabkan LRA Sg Semenyih dan LRA Bukit Tampoi, dihentikan sementara operasi bermula hari ini. #GetaranMY  |  #Semasa getaran.my getaran.my Pencemaran Loji Rawatan Air, Kerajaan Selangor Laksana 4 Langkah Drastik Atasi Pencemaran Pencemaran Loji Rawatan Air, Kerajaan Selangor Laksana 4 Langkah Drastik Atasi Pencemaran KUALA LUMPUR – Kerajaan Selangor sudah melaksanakan empat langkah serta-merta bagi menangani pencemaran bau di Stesen Pam Air Mentah Jenderam Hilir yang menyeba... KUALA LUMPUR – Kerajaan Selangor sudah melaksanakan empat langkah serta-merta bagi menangani pencemaran bau di Stesen Pam Air Mentah Jenderam Hilir yang menyeba... 1 1 1 1 1 1 308 308 308",24-12-2022 20:16,0,0,0,https://x.com/getaranmy/status/1606639849943216128
Astro AWANI,Astro AWANI Astro AWANI @501Awani · Lembaga Urus  Air  Selangor (LUAS) mengesan berlaku  pencemaran  bau di lokasi pemantauan statik 1.5 km daripada muka sauk Jenderam Hilir. #AWANInews #AWANI745 astroawani.com astroawani.com Pencemaran bau: LRA Sungai Semenyih dihenti tugas Pencemaran bau: LRA Sungai Semenyih dihenti tugas Lembaga Urus Air Selangor (LUAS) mengesan berlaku pencemaran bau di lokasi pemantauan statik 1.5 kilometer (km) daripada muka sauk Jenderam Hilir pada jam 6.30 petang Sabtu. Lembaga Urus Air Selangor (LUAS) mengesan berlaku pencemaran bau di lokasi pemantauan statik 1.5 kilometer (km) daripada muka sauk Jenderam Hilir pada jam 6.30 petang Sabtu. 2 2 2 31 31 31 25 25 25 27K 27K 27K,31-12-2022 21:56,0,0,0,https://x.com/501Awani/status/1609201904067936257
Irfan_newboys,"Irfan_newboys Irfan_newboys @Marchfoward · TERKINI

Tentera Nasional Indonesia Angkatan Udara memintas sebuah pesawat yang terbang daripada Kuching ke Senai, Malaysia di Batam, Indonesia

Ini kerana pesawat itu memasuki ruang udara Indonesia tanpa izin dan tanpa cukup dokumen 

Pesawat itu didaratkan di Batam 12 12 12 261 261 261 809 809 809",14-05-2022 10:47,0,0,0,https://x.com/Marchfoward/status/1525321904885682176
SinarHarian,SinarHarian SinarHarian @SinarOnline · SPAN memandang serius insiden pelepasan efluen terlarang ke alur  air  sehingga mengakibatkan  pencemaran  bau di Negeri Sembilan dan Selangor pada Khamis dan Jumaat lalu. https:// 1 1 1 1 1 1 8 8 8,03-12-2022 18:46,0,0,0,https://x.com/SinarOnline/status/1599007067347750913
Astro AWANI,Astro AWANI Astro AWANI @501Awani · Ia susulan insiden  pencemaran  bau dikesan di Stesen Pam  Air  Mentah Jenderam Hilir melibatkan Loji Rawatan  Air  (LRA) Sungai Semenyih dan LRA Bukit Tampoi. #AWANInews #AWANI745 astroawani.com astroawani.com 85 lori tangki air digerakkan bantu pengguna terjejas - Air Selangor 85 lori tangki air digerakkan bantu pengguna terjejas - Air Selangor Ia susulan insiden pencemaran bau dikesan di Stesen Pam Air Mentah Jenderam Hilir melibatkan Loji Rawatan Air (LRA) Sungai Semenyih dan LRA Bukit Tampoi. Ia susulan insiden pencemaran bau dikesan di Stesen Pam Air Mentah Jenderam Hilir melibatkan Loji Rawatan Air (LRA) Sungai Semenyih dan LRA Bukit Tampoi. 13 13 13 15 15 15 20K 20K 20K,24-12-2022 22:51,0,0,0,https://x.com/501Awani/status/1606679012059000832
aiamDeen,"aiamDeen aiamDeen @aiamDeen · Alahai bdk PAS ni, itu sungai (aku pun marah klau sg ada  pencemaran ),  air  yg sampai ke setiap rumah bersih selepas di tapis.

Bkn sampai rumah rakyat terus minum teh tarik..Apa kebenda ni kau ni?

Kau blh fikir tak  air  teh tarik sampai rumah mcm mana org nk ambil wudhu utk solat?  https:// /YazidAiman4/status/1585563655885959168 … This post is unavailable. 1 1 1 6 6 6",27-10-2022 19:45,0,0,0,https://x.com/aiamDeen/status/1585613553175666688
datuk kamal,"datuk kamal datuk kamal @karmenlunarxisc · Altho i dont like farmed udang and fish, but i understand farmed seafood is our future.

Sebelum kita masuk ke topik dan benda utk diskas sebab aku boring nak mampus, secara kolektifnya, orang sabah kalau sayang negeri patut jaga kualiti  air  -  pencemaran  laut. 3 3 3 7 7 7 2K 2K 2K",16-12-2022 20:37,0,0,0,https://x.com/karmenlunarxisc/status/1603746181636845570
Wan Arief Imran,"Wan Arief Imran Wan Arief Imran @wanariefimran · Kalau jadi macam ni on your flight, tak perlu panic. Cermin kapal terbang ada 3 lapis. Lapisan dalam, diperbuat daripada plastik (acrylic) untuk protect the actual windows, the middle & outer layer, from being damaged by passengers. Ed Ed @edjunaidi · Seramnya tingkap tercabut.  (Dapat dari WhatsApp) 0:47 0:47 1 1 1 1.2K 1.2K 1.2K 1.4K 1.4K 1.4K",29-06-2022 17:55,0,0,0,https://x.com/wanariefimran/status/1542099359864864769
SinarHarian,SinarHarian SinarHarian @SinarOnline · Penurunan signifikan kes kecemasan kod merah pada tahun ini sekali gus menunjukkan bilangan gangguan bekalan  air  tidak berjadual disebabkan  pencemaran  berkurangan. https:// 3 3 3,25-11-2022 17:16,0,0,0,https://x.com/SinarOnline/status/1596085409238642688
izzi,"izzi izzi @IzzraifHarz · a reminder that current "" air  pasang besar"" will be our normal "" air  pasang"" in the future due to climate change, idk how ready are we to face it Harian Metro Harian Metro @hmetromy · Fenomena air pasang besar landa Kuala Kedah •  #alorsetar #alorsetar  Fenomena air pasang besar yang melanda kawasan Kuala Kedah hari ini menyebabkan beberapa kawasan dinaiki air. https://hmetro.com.my/mutakhir/2022/09/880827/fenomena-air-pasang-besar-landa-kuala-kedah-metrotv… https:// 09/880827/fenomena-air-pasang-besar-landa-kuala-kedah-metrotv … 4 4 4 1.3K 1.3K 1.3K 1.4K 1.4K 1.4K",11-09-2022 19:42,0,0,0,https://x.com/IzzraifHarz/status/1568943037757407234
ANTARA Business News,ANTARA Business News ANTARA Business News @antarabiz · Inovasi Balai Kemenperin cegah  pencemaran air  dan udara industri  http://,26-09-2022 21:01,0,0,0,https://x.com/antarabiz/status/1574398795538124800
Radar Tulungagung,"Radar Tulungagung Radar Tulungagung @ratunews · Pencemaran Air  Limbah di Desa Sidorejo, Bupati Maryoto: IPAL PG Modjopanggoong Harus Dibenahi  https://",01-11-2022 10:43,0,0,0,https://x.com/ratunews/status/1587289186583064577
eR.Wie,"eR.Wie eR.Wie @RyaWiedy · Yang bikin Kementerian PUPR yaa, mas……
Titenono….  Top! 2 Proyek Air Bersih buat Warga Jakarta Digeber Tahun Ini 70 70 70 70 70 70 307 307 307",04-03-2022 08:22,0,0,0,https://x.com/RyaWiedy/status/1499555748904194048
caja ˙ᵕ˙,"caja ˙ᵕ˙ caja ˙ᵕ˙ @ycalendula · kalau omputih nampak orang malaysia hari hari cuci rambut boleh koma diorang cakap kita punca utama  pencemaran air naa naa @ainathrh_ · every salon i went, semua hairstylist cakap “rambut u cantik, kulit banyak sihat” when i told them i cuci hari hari & even double cleansed my hair they said — x.com/draenbebel/sta… 1 1 1 223 223 223",21-12-2022 22:15,0,0,0,https://x.com/ycalendula/status/1605582635320848385
Koran Jakarta,Koran Jakarta Koran Jakarta @koranjakarta_id · Hampir 70 Persen  Air  Minum Rumah Tangga di RI Tercemar Tinja #koranjakarta #unicef #PBB #water #kemenkes #airminumtercemartinja #pencemaran #air #diare #sanitasi #infoterkini #indonesia #news #update https:// en-air-minum-rumah-tangga-di-ri-tercemar-tinja?page=all … 13 13 13,04-11-2022 09:37,0,0,0,https://x.com/koranjakarta_id/status/1588359831215214594
detikcom,detikcom detikcom @detikcom · Direktur Utama PAM Jaya Arief Nasrudin mengatakan daerah dekat laut menjadi wilayah dengan  pencemaran air  tanah tertinggi di Jakarta. PAM Jaya Ungkap Kawasan dengan Pencemaran Air Tertinggi di DKI 1 1 1,15-11-2022 07:53,0,0,0,https://x.com/detikcom/status/1592319899539451905
Ja',"Ja' Ja' @AdukaTeruna90 · @rayhanburhan Siapa cakap tidak sah ya ??

Untuk pengetahuan Ustaz,  air  dalam kapal bukan untuk dibuat  air  sembahyang.

Kapal membawa sejumlah  air  yg limited utk kegunaan semua penumpang ketika mereka menggunakan tandas

Tahunkah anda kalau  air  tidak mencukupi sewaktu penerbangan.

Bebenang/ 24 24 24 77 77 77 211 211 211",11-02-2022 19:27,0,0,0,https://x.com/AdukaTeruna90/status/1492113027461570561
Aktual Official,Aktual Official Aktual Official @aktualofficial · DPRD Minta Pemprov DKI Serius Urusi  Pencemaran Air  Tanah  https:// prov-dki-serius-urusi-pencemaran-air-tanah/ …,29-09-2022 21:36,0,0,0,https://x.com/aktualofficial/status/1575494712957759488
nabilah,"nabilah nabilah @nabilah_nusri · Selangor takde  air  usually sebab maintenance, paip pecah or ada  pencemaran air . Kelantan takde  air  memang betul2 takde  air  or keluar  air  karat espresso tu. KNB KNB @nizambakeri · ""Selangor pun tak ada air air, samalah macam Kelantan. Jangan tanya kenapa diorang masih sokong PAS, kau tu kenapa masih sokong PH?""

Honey, you didn't just equate Air Selangor with Air Kelantan, did you. 5 5 5 609 609 609",25-12-2022 21:41,0,0,0,https://x.com/nabilah_nusri/status/1607023807226843138
AKMAL ARIF,"AKMAL ARIF AKMAL ARIF @akmalarif90 · Getaran Pencemaran  Loji Rawatan  Air , Kerajaan Selangor Laksana 4 Langkah Drastik Atasi  Pencemaran 31 minit yang lalu -  https:// 298 298 298",24-12-2022 20:42,0,0,0,https://x.com/akmalarif90/status/1606646615967948801
Cemonk,Cemonk Cemonk @Perilotus · @Perilotus Skuadron pengebom terdiri dari pesawat-pesawat Ilyushin-28 dan pengebom jarak jauh TU-16 dengan berpeluru kendali. Juga skuadron pesawat angkut Antonov dan sebagainya. 2 2 2 22 22 22 178 178 178,18-04-2022 19:55,0,0,0,https://x.com/Perilotus/status/1516037620563779584
Irfan_newboys,"Irfan_newboys Irfan_newboys @Marchfoward · @Marchfoward Awam Malaysia (CAAM)

PDRM Bidor sedang menjalankan operasi SAR

Sepatutnya helikopter itu mendarat di Lapangan Terbang Sultan Azlan Shah, Ipoh, Perak Jam 12.37 Tengah hari tadi

Menteri Pengangkutan Malaysia menerima laporan Jam 1 Tgh hari tadi dari CAAM 2 2 2 70 70 70 245 245 245",11-09-2022 15:52,0,0,0,https://x.com/Marchfoward/status/1568885108685565955
thv,thv thv @taehyunqr_ · Butuh Joki tugas bikin artikel tentang isu² lingkungan hidup:  pencemaran air  dan udara... Butuh cepet  #zonauang️ #zonajoki 18 18 18,01-12-2022 15:01,0,0,0,https://x.com/taehyunqr_/status/1598225885941100545
Jamban Dari Syurga,"Jamban Dari Syurga Jamban Dari Syurga @eryazmi · Nak sembang  pencemaran air  sungai, aku dah bentang dah isu ni last year kat JAS putrajaya,  air  selangor SSP, LUAS, Pejabat SUK Selangor

Apa yang aku boleh kata,  pencemaran  kat Selangor = masalah perangai kilang2 swasta & publik

Masalah  Air  Kelantan = Management AKSB & PAS bodoh 2 2 2",06-11-2022 18:18,0,0,0,https://x.com/eryazmi/status/1589215710399844352
Harith,"Harith Harith @Ismeharith · Masalah  pencemaran air  kat selangor ni macam mana pulak? Kalau sudi boleh buat thread on the water chemistry and engineering side jugak.  Jamban Dari Syurga Jamban Dari Syurga @eryazmi · Aku nak santai2 buka topik kenapa air boleh kotor kat Kelantan, dari skop punca asal & chain reaction kesinambungan dan kesinambungkinabatangan. 

Ready? Show this poll 1 1 1",22-11-2022 10:09,0,0,0,https://x.com/Ismeharith/status/1594890751485546497
Wisata Pulau Seribu,Wisata Pulau Seribu Wisata Pulau Seribu @WisataPulau1000 · SDA DKI :  Pencemaran Air  Tanah Terjadi Karena  Air  Limbah Domestik Belum Dikelola Sesuai Standar - Harian Terbit - Harian Terbit  http://,08-11-2022 05:25,0,0,0,https://x.com/WisataPulau1000/status/1589745776460460032
ijusu01@twiter.com,ijusu01@twiter.com ijusu01@twiter.com @Ijusu1 · Ketua Perwakim Dan Ketua Umum (ABB) Angkat Bicara Terkait Minyak CPU Tumpah  Pencemaran Air  Laut  https:// ua-perwakim-dan-ketua-umum-abb-angkat-bicara-terkait-minyak-cpu-tumpah-pencemaran-air-laut/ …,10-11-2022 20:48,0,0,0,https://x.com/Ijusu1/status/1590702966448734210
DewaBiz.com,DewaBiz.com DewaBiz.com @DewaBizMedia · Teknologi Pengolahan  Air  Limbah yang Inovatif untuk Mengatasi  Pencemaran : Teknologi Pengolahan  Air  Limbah – Limbah industri dan rumah tangga merupakan sumber utama  pencemaran air  permukaan…  http:// #Technology #PengolahanAirLimbah #TeknologiPengolahanAirLimbah 7 7 7,25-12-2022 21:40,0,0,0,https://x.com/DewaBizMedia/status/1607023370251677699
